M000243,At which battle in 9 AD did the Germanic leader Arminius annihilate three Roman legions?,TEUTOBERG FOREST
M000244,To which tribe did Arminius belong?,CHERUSCI
M000245,Who was the Roman commander whose legions were annihilated?,QUINCTILIUS VARUS
M000246,Complete the following analogy: verus : veritas :: diligens : __________.,DILIGENTIA
M000247,Complete the following analogy: iratus : ira :: timidus : ______________,TIMOR
M000248,Complete the following analogy: multus : multitūdō :: dulcis : _____________,DULCEDO
M000249,What great warior> originally named Ligyron> was the son of Peleus and Thetis?,ACHILLES
M000250,Which group of warriors did Achilles lead?,MYRMIDONS
M000251,After killing Clytonomous> which son of Menoetius sought shelter with Achilles and became his favorite companion?,PATROCLUS
M000252,Responde Latine: homines multa agunt. Mercator negotium gerit. Quid agricola gerit?,LABORAT IN AGRIS; AGRUM COLIT> ETC.
M000253,Quid ianitor gerit?,IANUAM CUSTODIT
M000254,Quid mango aut venalicius gerit?,SERVOS VENDIT