F001156,Who was the father of Memnon> king of the Ethiopians?,TITHONUS
F001157,Who was the brother of Tithonus?,PRIAM
F001158,Into what were Memnon's brothers transformed after his death?,BIRDS (FLEW AROUND HIS TOMB)
F001159,Who guided the arrow> shot by Paris> which wounded Achilles?,APOLLO
F001160,Who recovered the corpse of Achilles?,AJAX THE GREATER
F001161,Where was the corpse of Achilles buried?,SIGEUM
F001162,With whose bones were those of Achilles mixed in a golden urn?,PATROCLUS
F001163,Whose ghost appears to the Greeks after Troy's fall to demand sacrifice?,ACHILLES
F001164,Who does the ghost of Achilles demand be sacrificed at his tomb?,POLYXENA
F001165,Who were the parents of Polyxena?,PRIAM AND HECUBA
F001166,What Greek hero went mad after losing the contest for Achilles' armor?,AJAX THE GREATER
F001167,What did Ajax the Greater do in his madness?,SLAUGHTERED SHEEP
F001168,How did Ajax the Greater die?,SUICIDE
F001169,What sprang from the blood of Ajax the Greater?,FLOWER (WITH AI-AI ON PETALS)
F001170,What Roman wrote a tragedy called Ajax?,SENECA THE YOUNGER
F001171,Who captured Helenus?,ODYSSEUS
F001172,What two heroes had to be summoned to capture Troy> according to Helenus?,NEOPTOLEMUS AND PHILOCTETES
F001173,What does the name of Neoptolemus mean?,NEW RECRUIT'
F001174,Who killed Priam at an altar?,NEOPTOLEMUS
F001175,Who built the Trojan Horse?,EPEUS
F001176,What bard sings of Troy in the Odyssey?,DEMODOCUS
F001177,What goddess helped Epeus build the Trojan Horse?,ATHENA
F001178,To whom does Odysseus tell of the Trojan Horse in the underworld?,ACHILLES
F001179,Who does Odysseus say was the one fellow warrior not afraid in the horse?,NEOPTOLEMUS
F001180,To what island did the Greek fleet sail when they left the Trojan Horse?,TENEDOS
F001181,What Greek was left behind with the Trojan Horse to explain its purpose?,SINON
F001182,What daughter of Priam foretold the truth of the Trojan Horse?,CASSANDRA
F001183,What priest hurled a spear at the Trojan Horse?,LAOCOON
F001184,Who was the father of Laocoon?,ANTENOR
F001185,What was the relationship of Hecuba to Laocoon?,AUNT
F001186,What happened to Laocoon and his two sons?,TWO SERPENTS ATTACKED THEM
F001187,Who walked around the horse imitating the voices of heroes' wives?,HELEN
F001188,Who was the son of Aeneas?,ASCANIUS (IULUS)
F001189,Who is the son of Hector?,ASTYANAX
F001190,Who received Andromache as his share of the spoils?,NEOPTOLEMUS
F001191,Who dragged Cassandra from her refuge in the temple of Athena?,AJAX THE LESSER
F001192,Who took Cassandra as his slave?,AGAMEMNON
F001193,Which Greek tragedian wrote the Agamemnon?,AESCHYLUS
F001194,Who received Hecuba as part of the spoils of Troy?,ODYSSEUS
F001195,Who recognized the corpse of her son wash up on the shore after leaving Troy?,HECUBA
F001196,Which of Hecuba's sons did she see wash up on the shore of Thrace?,POLYDORUS
F001197,To whom did Priam send his son Polydorus for safe refuge during the war?,POLYMESTOR
F001198,Who killed Polydorus> the son of Priam and Hecuba?,POLYMESTOR
F001199,Who took revenge on Polymestor by killing his children and blinding him?,HECUBA
F001200,Who was turned into a female dog in the aftermath of the Trojan War?,HECUBA
F001201,What was the name of Hecuba's burial place?,CYNOSSEMA
F001202,What does Cynossema> the place of Hecuba's burial> mean?,DOG'S TOMB
F001203,What Greek tragedian wrote the Trojan Women?,EURIPIDES
F001204,In what book of the Aeneid does Vergil describe the fall of Troy?,SECOND
F001205,What city was famed for the Scaean gates?,TROY
F001206,What wife of Aeneas was lost as he fled the city?,CREUSA
F001207,Who carried his crippled father on his shoulder from the burning city of Troy?,AENEAS
F001208,What epic poem> now almost entirely lost> details the Greek returns from Troy?,NOSTOI
F001209,What does Nostoi mean?,RETURNS
F001210,Who wrote the Odyssey?,HOMER
F001211,What contingent did Ajax the Lesser lead at Troy?,LOCRIANS (PEOPLE OF LOCRIS)
F001212,With what other king did Ajax the Lesser begin his journey home?,AGAMEMNON
F001213,Who caused a storm to wreck many of Ajax the Lesser's ships?,ATHENA
F001214,Near what island did Athena cause many of Ajax the Lesser's ships to wreck?,MYKONOS
F001215,Who boasted from a rock in the sea that even the Gods couldn't prevent his escape?,AJAX THE LESSER
F001216,Who split the rock where Locrian Ajax sat> hurling him into the sea?,POSEIDON
F001217,Who lured many ships to their destruction with a false beacon?,NAUPLIUS
F001218,Why did Nauplius lure Greek ships to their doom with a false beacon?,AVENGING HIS SON PALAMEDES
F001219,Off what cape did Nauplius draw shipwrecks with a false beacon?,CAPE CAPHAREUS
F001220,Who killed Agamemnon?,CLYTEMNESTRA AND AEGISTHUS
F001221,What was the kingdom of Nestor?,PYLOS
F001222,Who was the only Greek king to travel safely by sea back to his kingdom?,NESTOR
F001223,Who advised Menelaus to force Nereus to explain how to get home safely?,EIDOTHEA
F001224,What was the relationship of Eidothea to Nereus?,DAUGHTER
F001225,Who told Menelaus how to return home safely?,NEREUS
F001226,Where did the encounter of Menelaus and Nereus occur?,EGYPT
F001227,How many years did it take Menelaus and Helen to return to Sparta?,7; SEVEN
F001228,What was unusual about the death of Menelaus?,DIDN'T GO TO HADES
F001229,Why didn't Menelaus go to Hades?,SON-IN-LAW OF ZEUS
F001230,What was the kingdom of Diomedes?,ARGOS
F001231,Who was the wife of Diomedes?,AEGIALIA
F001232,Who was the father of Aegialia?,ADRASTUS (FROM 7 AGAINST THEBES)
F001233,Who caused Aegialia to be unfaithful to her husband Diomedes?,APHRODITE
F001234,Why did Aphrodite cause Aegialia to be unfaithful to Diomedes?,DIOMEDES WOUNDED APHRODITE
F001235,To what land did Diomedes go after abandoning Argos?,ITALY
F001236,Who gave Diomedes land in Italy?,DAUNUS
F001237,What was the kingdom of the Daunus who gave Diomedes land?,APULIA
F001238,Who asked Diomedes to help him fight against Aeneas?,LATINUS
F001239,According to some accounts> who turned Diomedes into an immortal god?,ATHENA
F001240,According to some accounts> into what were the followers of Diomedes transformed?,BIRDS
F001241,Who led the Cretan forces at the Trojan War?,IDOMENEUS
F001242,Who was the wife of Idomeneus?,MEDA
F001243,With whom did Meda commit adultery while her husband Idomeneus was away?,LEUCUS
F001244,Who drove Idomeneus out of Crete?,LEUCUS
F001245,Where did Idomeneus go after being driven out of Crete by Leucus?,CALABRIA> IN ITALY (THE HEEL OF THE BOOT)
F001246,Who vowed to sacrifice to Poseidon the first thing that met him upon arriving home?,IDOMENEUS
F001247,Where was the home of Philoctetes?,THESSALY
F001248,What do the return stories of Diomedes> Idomeneus and Philoctetes have in common?,FOUNDED ITALIAN COLONIES
F001249,Who warned Neoptolemus not to return from Troy by sea?,THETIS
F001250,What was the relationship of Thetis to Neoptolemus?,GRANDMOTHER
F001251,What Trojan prince accompanied Neoptolemus home from Troy?,HELENUS
F001252,What Trojan widow accompanied Neoptolemus home from Troy?,ANDROMACHE
F001253,Who was the wife of Neoptolemus?,HERMIONE
F001254,Who were the parents of Hermione?,MENELAUS AND HELEN
F001255,Where was Neoptolemus killed?,DELPHI
F001256,Who wrote the Poetics?,ARISTOTLE
F001257,Who inherited the divine armor of Achilles?,ODYSSEUS
F001258,Who was the faithful wife of Odysseus?,PENELOPE
F001259,What was the island kingdom of Odysseus?,ITHACA
F001260,Where is Odysseus when Homer's Odyssey begins?,OGYGIA
F001261,With whom does Odysseus stay on Ogygia?,CALYPSO
F001262,How many years did it take for Odysseus to get from Troy to Ithaca?,10; TEN
F001263,What was the first city Odysseus came to after leaving Troy?,ISMARUS
F001264,In what region was Ismarus located?,THRACE
F001265,What tribe lived at Ismarus?,CICONES
F001266,What priest of Apollo was spared in Odysseus' attack of Ismarus?,MARON
F001267,What did Maron give Odysseus in return for being spared?,12 JARS OF RED WINE
F001268,To whose land did Odysseus go after the Cicones?,LAND OF THE LOTUS-EATERS
F001269,What effect did the Lotus flowers have in the Land of the Lotus-Eaters?,FORGET EVERYTHING> NOT WANT TO LEAVE
F001270,To whose land did Odysseus go after the Land of the Lotus-Eaters?,CYCLOPS
F001271,What Cyclops was encountered by Odysseus and his men?,POLYPHEMUS
F001272,Who was the father of Polyphemus?,POSEIDON
F001273,How many of Odysseus' men did Polyphemus eat?,6; SIX
F001274,With wine from what priest did Odysseus get Polyphemus drunk?,MARON
F001275,What did Odysseus first tell Polyphemus his name was?,NOBODY (OUTIS)
F001276,Who drove a hot wooden stake into the eye of Polyphemus?,ODYSSEUS
F001277,How did Odysseus escape the cave of Polyphemus?,ON THE BELLY OF SHEEP
F001278,What father of Polyphemus cursed Odysseus?,POSEIDON
F001279,To whose floating island did Odysseus go after escaping from Polyphemus?,AEOLUS
F001280,Who gave Odysseus a bag of winds?,AEOLUS
F001281,What did Odysseus' men believe was in the bag of Aeolus?,GOLD/TREASURE
F001282,Whose island did Odysseus end up at after his men opened the bag of winds?,AEOLUS
F001283,What cannibals were visited by Odysseus after his second visit to Aeolus?,LAESTRYGONIANS
F001284,With how many ships did Odysseus leave the land of the Laestrygonians?,1; ONE
F001285,Who resided on Aeaea?,CIRCE
F001286,Who was the father of Circe?,HELIUS
F001287,How many men went ahead of Odysseus to meet Circe?,23; TWENTY-THREE
F001288,Who tranformed Odysseus' men into swine?,CIRCE
F001289,Which of Odysseus' men was not transformed into swine?,EURYLOCHUS
F001290,Who told Odysseus that his men had been transformed into swine?,EURYLOCHUS
F001291,Who told Odysseus how to overcome Circe's charms?,HERMES
F001292,What magic herb was given by Hermes to Odysseus?,MOLY
F001293,What herb's had a black root and flower as white as milk?,MOLY
F001294,For how long did Odysseus live with Circe?,1 YEAR; ONE YEAR
F001295,Who was the son of Odysseus and Circe?,TELEGONUS
F001296,Who told Odysseus that he must go to the underworld to speak with Tiresias?,CIRCE
F001297,Which book of the Odyssey is sometimes called the Nekuia> or Book of the Dead?,BOOK 11; BOOK ELEVEN
F001298,What is different about how far into the underworld Odysseus and Aeneas travel?,ODYSSEUS STOPS AT ENTRANCE
F001299,Who told Odysseus that he would find arrogant suitors in Ithaca and would kill them?,TIRESIAS
F001300,What did the underworld spirits need to do to be able to speak with Odysseus?,DRINK BLOOD OF SACRIFICIAL VICTIM
F001301,What woman did Odysseus meet in the underworld?,ANTICLEA (HIS MOTHER)
F001302,What three heroes did Odysseus meet in the underworld?,AGAMEMNON> ACHILLES> AJAX GREATER
F001303,Who said he would rather be a slave to a poor man on earth than king over all dead souls?,ACHILLES
F001304,Because of what fear did Odysseus leave the house of Hades?,FEARED THE APPEARANCE OF GORGON'S HEAD
F001305,What birdlike creatures with women's heads lured passing sailors onto rocks?,SIRENS
F001306,How did Odysseus' men escape the Sirens' song?,WAX IN EARS
F001307,How did Odysseus escape the Sirens' song?,TIED TO MAST
F001308,What was the name of the wandering rocks encountered by Odysseus and the Argo?,PLANCTAE
F001309,What monster sucked in the water of a strait and spouted it out again three times a day?,CHARYBDIS
F001310,What monster lived in a cliff opposite Charybdis?,SCYLLA
F001311,Who was the father of Scylla?,PHORCYS
F001312,Who had transformed Scylla into a monster?,AMPHITRITE
F001313,What monster had six dogs' heads and twelve feet> and snatched sailors from ships?,SCYLLA
F001314,On what island did Helius pasture his herds?,THRINACIA
F001315,Who warned Odysseus not to touch any of the Cattle of the Sun?,CIRCE
F001316,What did Odysseus' men do on Thrinacia?,KILLED SOME OF CATTLE OF SUN
F001317,To whom did Helius pray to punish Odysseus?,ZEUS
F001318,How many of Odysseus' men survived after visiting Thrinacia?,0; NONE
F001319,What was the island of Calypso?,OGYGIA
F001320,Who lived on the island of Ogygia?,CALYPSO
F001321,Who was the father of Calypso?,ATLAS
F001322,For how long did Odysseus live with Calypso?,7 YEARS; SEVEN YEARS
F001323,Who brought orders from Zeus for Calypso to let Odysseus go?,HERMES
F001324,What was the island of the Phaeacians?,SCHERIA
F001325,Into what sea goddess was Ino> daughter of Cadmus> transformed?,LEUCOTHEA
F001326,What sea goddess> along with Athena> helped Odysseus reach the shore of Scheria?,LEUCOTHEA
F001327,Who was the king of the Phaeacians when Odysseus visited?,ALCINOUS
F001328,What Phaeacian princess was the daughter of Alcinous?,NAUSICAA
F001329,What queen of the Phaeacians was the wife of Alcinous and mother of Nausicaa?,ARETE
F001330,Who discovered Odysseus washed up on the shores of Scheria?,NAUSICAA
F001331,Who turned the Phaeacian ship> which had safely returned Odysseus> into stone?,POSEIDON
F001332,Who delayed her suitors by weaving a cloak which she unthreaded each night?,PENELOPE
F001333,For whom was the burial cloak which Penelope wove?,LAERTES
F001334,Who disguised Odysseus as a beggar?,ATHENA
F001335,What faithful swineherd of Odysseus first recognized him?,EUMAEUS
F001336,What son of Odysseus had been told by Menelaus and Nestor that his father was alive?,TELEMACHUS
F001337,What was the name of Odysseus' dog> who died upon seeing his master return?,ARGUS
F001338,What beggar was knocked out by Odysseus in a fight amid the suitors?,IRUS
F001339,Who succeeded in stringing a great bow and shooting an arrow through 12 axe heads?,ODYSSEUS
F001340,What nurse of Odysseus recognized him by a scar on his leg?,EURYCLEIA
F001341,With what grandfather was Odysseus hunting when he received the scar on his leg?,AUTOLYCUS
F001342,What herald was spared while Odysseus slew the suitors of Penelope?,MEDON
F001343,What bard was spared while Odysseus slew the suitors of Penelope?,PHEMIUS
F001344,What disloyal goatherd of Odysseus was mutilated and killed?,MELANTHIUS
F001345,Who is described by Homer as `polytropos`?,ODYSSEUS
F001346,What does of polytropos mean?,MAN OF TWISTS AND TURNS
F001347,Whom does Homer describe as `periphron`?,PENELOPE
F001348,What does periphron mean?,CIRCUMSPECT (WARY)
F001349,Who has a dream in which an eagle kills a flock of twenty geese?,PENELOPE
F001350,What object does Odysseus use to prove his identity to Penelope?,MARRIAGE BED
F001351,What part of Odysseus' marriage bed could not be moved?,LIVE OLIVE TREE
F001352,What did Calypso offer Odysseus?,IMMORTALITY
F001353,Which suitor's ghost tells Agamemnon of Odysseus return to Ithaca?,AMPHIMEDON
F001354,Who was the father of Penelope?,ICARIUS
F001355,Who kills Eupeithes> father of Antinous?,LAERTES
F001356,Who was the most insolent of Penelope's suitors?,ANTINOUS
F001357,Who carried an oar until people thought it was a winnowing fan?,ODYSSEUS
F001358,Who had told Odysseus to carry an oar until people thought it was a winnowing fan?,TIRESIAS
F001359,What did Odysseus do to the oar he carried?,PLANTED IT AND SACRIFICED TO POSEIDON
F001360,Who killed Odysseus?,TELEGONUS
F001361,Who were the parents of Telegonus?,ODYSSEUS AND CIRCE
F001362,What goddess had a center of worship in Argos?,HERA
F001363,Who established the kingdom of Argos?,PHORONEUS
F001364,Between what two deities did Phoroneus choose for Argos?,HERA AND POSEIDON
F001365,Whom did Phoroneus choose as chief deity for Argos?,HERA
F001366,What river was the father of Phoroneus?,INACHUS
F001367,What did Poseidon do to Inachus after Argos rejected him?,DRIED INACHUS UP
F001368,Who wrote the Nemean Ode?,PINDAR
F001369,Who were the twin sons of Abas?,PROETUS AND ACRISIUS
F001370,Who was the father of Proetus and Acrisius?,ABAS
F001371,What twins quarrelled even in the womb?,PROETUS AND ACRISIUS
F001372,What city was ruled by Acrisius?,ARGOS
F001373,What city was ruled by Proetus?,TIRYNS
F001374,Who was the daughter of Acrisius?,DANAE
F001375,What was the destiny of Danae's child?,KILL ACRISIUS
F001376,Who was the sister of Phoroneus?,IO
F001377,Who was the child of Io and Zeus?,EPAPHUS
F001378,Who was the child of Epaphus?,LIBYA
F001379,Who were the two sons of Libya?,BELUS AND AGENOR
F001380,Who were the two most famous children of Agenor?,CADMUS AND EUROPA
F001381,What cousins of Cadmus were the sons of Belus?,DANAUS AND AEGYPTUS
F001382,How many sons did Aegyptus have?,FIFTY
F001383,Whose daughters were the brides of Aegyptus' sons?,DANAUS
F001384,Which of Danaus' daughters didn't kill her husband?,HYPERMNESTRA
F001385,What son of Aegyptus wasn't killed by his bride?,LYNCEUS
F001386,Who was the son of Hypermnestra and Lynceus?,ABAS
F001387,Who were the two children of Phoroneus?,NIOBE AND APIS
F001388,Who was shut up in a brazen chamber or tower by her father?,DANAE
F001389,In what form did Zeus enter the chamber of Danae?,GOLDEN SHOWER
F001390,Who was the son of Zeus and Danae?,PERSEUS
F001391,Who put Danae and her infant son into a chest and to sea?,ACRISIUS
F001392,To what island did Danae and Perseus float in a chest?,SERIPHOS
F001393,What fisherman found Perseus and Danae on Seriphos?,DICTYS
F001394,What brother of Dictys was king of Seriphos?,POLYDECTES
F001395,Who boasted that he could get the head of Medusa?,PERSEUS
F001396,What two deities helped Perseus overcome Medusa?,HERMES AND ATHENA
F001397,What aged women were the sisters of the Gorgons?,GRAEAE
F001398,For how much of their lives were the Graeae old women?,FROM BIRTH
F001399,What two objects did the Graeae share?,EYE> TOOTH
F001400,How did Perseus persuade the Graeae to help him?,TOOK EYE OR TOOTH
F001401,Whom did the Graeae help Perseus find?,NYMPHS WITH TOOLS
F001402,What objects did Perseus get from nymphs to help him?,CAP> SANDALS> WALLET
F001403,What was the magical wallet of Perseus called?,KIBISIS
F001404,Who gave Perseus a scimitar?,HERMES
F001405,Who wrote the Pythian Odes?,PINDAR
F001406,What happy beings lived perfect lives in the North?,HYPERBOREANS
F001407,Who beheaded Medusa?,PERSEUS
F001408,To what group did Medusa belong?,GORGONS
F001409,Who were the sisters of Medusa?,STHENO AND EURYALE
F001410,What creatures name meant `he of the golden sword`?,CHRYSAOR
F001411,What winged horse was the child of Poseidon and Medusa?,PEGASUS
F001412,What cattle-driving monster was the son of Chrysaor?,GERYON
F001413,What fountain sprung from the kick of Pegasus?,HIPPOCRENE
F001414,On what mountain was the Hippocrene fountain?,MT. HELICON
F001415,On whose cries did Athena model the sound of the flute?,SISTERS OF MEDUSA
F001416,Who were the parents of the Gorgons?,PHORCYS AND CETO
F001417,What maiden was rescued by Perseus on his return?,ANDROMEDA
F001418,Who was the father of Andromeda?,CEPHEUS
F001419,Who was the mother of Andromeda?,CASSIOPEIA
F001420,Where was Cepheus king?,ETHIOPIA
F001421,Who boasted she was more beautiful than the Nereids?,CASSIOPEIA
F001422,Who sent a sea monster to punish the boasts of Cassiopeia?,POSEIDON
F001423,Who was chained to a rock to appease a sea monster?,ANDROMEDA
F001424,What brother of Cepheus had been betrothed to Andromeda?,PHINEUS
F001425,What son of Perseus and Andromeda was born in Ethiopia?,PERSES
F001426,From whose blood did poisonous African snakes spring?,MEDUSA
F001427,Whose gaze created the Atlas Mountains?,MEDUSA
F001428,How did Perseus treat Polydectes on his return?,TURNED TO STONE
F001429,To where did Acrisius flee upon Perseus' return?,LARISSA
F001430,How did Acrisius die?,HIT WITH DISCUS
F001431,Who threw the discus that killed Acrisius?,PERSEUS
F001432,Who exchanged kingdoms with Perseus?,MEGAPENTHES
F001433,Who was the father of Megapenthes?,PROETUS
F001434,What kingdom did Megapenthes trade to Perseus?,TIRYNS
F001435,What kingdom did Perseus trade to Megapenthes?,ARGOS
F001436,What important city did Perseus found as he ruled Tiryns?,MYCENAE
F001437,What great demi-god descended from Perseus?,HERACLES
F001438,What tragedian wrote Prometheus Bound?,AESCHYLUS
F001439,Who was changed into a white cow by jealous Hera?,IO
F001440,Into what was Io changed by a jealous Hera?,WHITE COW (HEIFER)
F001441,Who was sent to guard Io?,ARGUS
F001442,Who killed Argus> earning the name Argeiphontes?,HERMES
F001443,What did Hera send to harass Io as she wandered?,GADFLY
F001444,Who was the son of Io and Zeus?,EPAPHUS
F001445,What Egyptian goddess was later identified as Io?,ISIS
F001446,Which of the sons of Libya was a Phoenician king?,AGENOR
F001447,Who was the twin brother of Agenor?,BELUS
F001448,Who was the mother of Minos?,EUROPA
F001449,Where was Minos king?,CRETE
F001450,Who founded Thebes?,CADMUS
F001451,Who twin boys were born to Belus in Egypt?,DANAUS AND AEGYPTUS
F001452,Who was the only daughter of Danaus to disobey her father?,HYPERMNESTRA
F001453,Who was the husband of Hypermnestra?,LYNCEUS
F001454,Who was the father of Lynceus> husband of Hypermnestra?,AEGYPTUS
F001455,Who was the uncle of Lynceus> husband of Hypermnestra?,DANAUS
F001456,Who were punished in underworld carrying leaking jars?,DANAIDES
F001457,Who was the child of Hypermnestra and Lynceus?,ABAS
F001458,Who was the father of Acrisius and Proetus?,ABAS
F001459,What spring of Argos was named for a maiden Poseidon saved?,AMYMONE
F001460,Who rescued Amymone from a satyr?,POSEIDON
F001461,Who led the Argives at the Trojan War?,DIOMEDES
F001462,Who was Diomedes father?,TYDEUS
F001463,Of what group was Tydeus a member?,SEVEN AGAINST THEBES
F001464,Who was the greatest seer of Argos?,MELAMPUS
F001465,What king of the Teleboans fought Electryon of Mycenae?,PTERELAUS
F001466,What possession of Electryon was taken by the Teleboans?,CATTLE
F001467,Who did Electryon make king of Mycenae> betrothing him to his daughter?,AMPHITRYON
F001468,Who was the father of Amphitryon?,ALCAEUS
F001469,What was the blood relationship of Electryon to Amphitryon?,UNCLE
F001470,Who was the daughter of Electryon?,ALCMENA
F001471,Who accidentally killed his uncle Electryon while throwing a club at the stolen cattle?,AMPHITRYON
F001472,Who purified Amphitryon for the murder of Electryon?,CREON
F001473,In what city did Creon purify Amphitryon for the murder of Electryon?,THEBES
F001474,What daughter of Pterelaus betrayed her city to Amphitryon?,COMAETHO
F001475,What special possession of Pterelaus did Comaetho pluck> thus taking away his immortality and the invincibility of the city?,GOLDEN HAIR
F001476,How did Amphitryon treat Comaetho for helping him take her city?,HE KILLED HER
F001477,In what form did Zeus seduce Alcmena while Amphitryon was attacking Pterelaus?,FORM OF AMPHITRYON
F001478,Into the length of how many nights did Zeus stretch his visit to Alcmena?,3; THREE
F001479,Who revealed the truth of Zeus' visit after the real Amphitryon returned to Alcmena?,TIRESIAS
F001480,Who was the son of Zeus and Alcmena?,HERACLES
F001481,Who was the son of Amphitryon and Alcmena> half-brother of Heracles?,IPHICLES
F001482,What Roman comedian wrote the Amphitruo> his only comedy on a myth subject?,PLAUTUS
F001483,Who were the paternal grandparents of Amphitryon?,PERSEUS & ANDROMEDA
F001484,Who were the paternal grandparents of Alcmena?,PERSEUS & ANDROMEDA
F001485,Who was the father of Eurystheus?,STHENELUS
F001486,Who was the wife of Sthenelus and mother of Eurystheus?,MENIPPE
F001487,What son of Electryon and Anaxo was the brother of Alcmena?,LICYMNIUS
F001488,What brother of Alcmena was later killed by a son of Heracles?,LICYMNIUS
F001489,Name the five sons of Perseus and Andromeda.,PERSES> ALCAEUS> ELECTRYON> STHENELUS> MESTOR
F001490,Who was the son of Iolaus?,IPHICLES
F001491,Who was both the mother and sister-in-law of Alcmena?,ANAXO
F001492,What two relationships did Anaxo have to Heracles?,AUNT AND GRANDMOTHER
F001493,What goddess most disliked Heracles?,HERA
F001494,What hero's name meant literally 'glory of Hera'?,HERACLES
F001495,What childbirth deity was called by Zeus to bring a great descendant of Perseus?,EILEITHYIA
F001496,Whose child's birth was hastened by Hera to trick Zeus?,STHENELUS
F001497,What child was born to Sthenelus and Menippe> 2 months early?,EURYSTHEUS
F001498,Whom did Hera send to delay Alcmena's labor?,EILEITHYIA
F001499,What nurse of Alcmena broke Eileithyia's spell by rushing out and falsely shouting `my mistress has born a son!`?,GALANTHIS
F001500,Into what did Eileithyia transform Galanthis for her trick?,WEASEL
F001501,Who wrote the Nemean Odes?,PINDAR
F001502,Who sent a pair of snakes to kill baby Heracles?,HERA
F001503,Who foretold Heracles' role in the Gigantomachy and eventual deification?,TIRESIAS
F001504,Who killed two serpents in his cradle?,HERACLES
F001505,Who taught chariot driving to Heracles?,AMPHITRYON
F001506,Who taught wrestling to Heracles?,AUTOLYCUS
F001507,Who taught archery to Heracles?,EURYTUS
F001508,Who taught music to Heracles?,LINUS
F001509,Who was the father of Linus?,APOLLO
F001510,Which of Heracles' teachers did he kill?,LINUS
F001511,How did Heracles kill Linus?,HIT WITH LYRE
F001512,What king had fifty daughters who entertained Heracles?,THESPIUS
F001513,Where was Thespius king?,THESPIAE (IN BOEOTIA)
F001514,What animal did Heracles kill near Mt. Cithaeron?,LION
F001515,What city's army did Heracles successfully lead in battle against the Minyans of Orchomenus?,THEBES
F001516,What prize did Creon> regent of Thebes> give to Heracles for helping the city?,HIS DAUGHTER MEGARA AS WIFE
F001517,Who was the father of Heracles' first wife Megara?,CREON
F001518,How many children did Heracles have by his first wife> Megara?,3; THREE
F001519,Who> in a fit of madness> killed his wife Megara and three children?,HERACLES
F001520,Who purified Heracles for killing Megara?,THESPIUS
F001521,Who first called Heracles by the name Heracles?,DELPHIC ORACLE
F001522,What name had been applied to Heracles before the Delphic oracle called him Heracles?,ALCIDES
F001523,To which of Heracles' ancestors did the name Alcides connect him?,ALCAEUS
F001524,What hero was also called Amphitryoniades?,HERACLES
