F001525,What is the Roman name of Heracles?,HERCULES
F001526,How did the Delphic oracle tell Heracles to purify himself for Megara's murder?,SERVE EURYSTHEUS
F001527,What city was the kingdom of Eurystheus?,TIRYNS
F001528,On what peninsula do Heracles' first six labors take place?,PELOPONNESE
F001529,How many famous labors did Heracles perform for Eurystheus?,TWELVE
F001530,On what temple's metopes were the 12 labors of Heracles depicted?,TEMPLE OF ZEUS AT OLYMPIA
F001531,What was the first of Heracles' labors?,NEMEAN LION
F001532,What Greek poet wrote the Idylls (the model for Vergil's Eclogues> by the way)?,THEOCRITUS
F001533,Where did Heracles journey for his first labor?,NEMEA
F001534,How did Heracles kill the Nemean Lion?,STRANGLED IT
F001535,How did Heracles skin the Nemean Lion?,WITH ITS OWN CLAW
F001536,Where did Heracles journey for his second labor?,LERNA
F001537,What creature did Heracles overcome in his second labor?,LERNAEAN HYDRA
F001538,What other creature helped the Hydra against Heracles?,CRAB
F001539,Who sent the giant crab to help the Lernaean Hydra?,HERA
F001540,Who helped Heracles against the Lernaean Hydra?,IOLAUS
F001541,What was the relationship of Iolaus to Heracles?,NEPHEW
F001542,Who was the father of Iolaus?,IPHICLES
F001543,What made the Lernaean Hydra so difficult to beat?,TWO HEADS GREW BACK WHEN ONE WAS CUT
F001544,How did Heracles defeat the Lernaean Hydra?,IOLAUS CAUTERIZED THE NECK WHEN A HEAD WAS CUT
F001545,What did Heracles do with the immortal head of the Hydra?,BURIED IT UNDER ROCK
F001546,What was special about the blood of the Hydra?,POISONOUS
F001547,What did Heracles do with the blood of the Hydra?,PUT IT ON HIS ARROWS
F001548,Into what constellation did Hera transform the crab?,CANCER
F001549,To where did Heracles journey for his 3rd labor?,CERYNEA
F001550,What creature did Heracles capture for his 3rd labor?,CERYNEAN HIND (STAG/DEER)
F001551,What was special about the horns of the Cerynean Hind?,GOLDEN
F001552,To what goddess was the Cerynean Hind sacred?,ARTEMIS
F001553,For how long did Heracles pursue the Cerynean Hind?,1 YEAR; ONE YEAR
F001554,By what river did Heracles catch the Cerynean Hind?,LADON RIVER
F001555,Who wrote the Olympian Ode?,PINDAR
F001556,According to Pindar> where did Heracles go to find the Cerynean Hind?,LAND OF HYPERBOREANS
F001557,According to Pindar> who stamped the Cerynean Hind's horns with Artemis' name?,TAYGETE
F001558,Who was the father of Taygete?,ATLAS (SHE WAS A PLEIAD)
F001559,To where did Heracles journey for his 4th labor?,MT. ERYMANTHUS
F001560,What creature did Heracles capture for his 4th labor?,ERYMANTHIAN BOAR
F001561,What did Heracles use to catch the Erymanthian Boar?,NETS
F001562,What did the terrified Eurystheus use to protect himself from Heracles' prey?,A LARGE JAR
F001563,What is the term for a side adventure of Heracles' labors?,PARERGON
F001564,What centaur served Heracles wine?,PHOLUS
F001565,What centaur was wounded by Heracles in a fight after Pholus shared his wine?,CHIRON
F001566,Who accepted Chiron's immortality to relieve him from his suffering?,PROMETHEUS
F001567,What centaur died when he accidentally dropped Heracles' poisoned arrow on his foot?,PHOLUS
F001568,To what kingdom did Heracles journey for his 5th labor?,ELIS
F001569,What king of Elis owned huge> filthy stables?,AUGEAS
F001570,Who was the father of Augeas?,HELIUS
F001571,How long did it take Heracles to clean the Augean stables?,1 DAY; ONE DAY
F001572,What two rivers did Heracles divert to clean the Augean stables?,ALPHEUS AND PENEUS
F001573,What son of Augeas took the side of Heracles in a dispute over payment?,PHYLEUS
F001574,What prince> near the Augean stables> entertained Heracles?,DEXAMENUS
F001575,From what centaur did Heracles rescue the daughter of Dexamenus?,EURYTION
F001576,How did Heracles respond to Augeas' failure to pay him?,HE KILLED HIM
F001577,Who did Heracles put on the throne of Elis to replace king Augeas?,PHYLEUS (AUGEAS' SON)
F001578,What Greek hero was said to have instituted the Olympic Games?,HERACLES
F001579,What type of trees supplied the laurels for Olympic victors?,OLIVE
F001580,To what lake in Arcadia did Heracles journey for his 6th labor?,LAKE STYMPHALUS
F001581,What creatures did Heracles overcome in his 6th labor?,STYMPHALIAN BIRDS
F001582,How did Heracles flush out the Stymphalian Birds?,CLASHING BRAZEN CASTANETS
F001583,Who gave Heracles the brazen castanets he used to flush out the Stymphalian Birds?,ATHENA
F001584,What did Heracles do after flushing out the Stymphalian Birds?,SHOT THEM WITH ARROWS
F001585,To where did Heracles journey for his 7th labor?,CRETE
F001586,What creature was captured by Heracles for his 7th labor?,CRETAN BULL
F001587,Who had provided the Cretan Bull to Minos?,POSEIDON
F001588,What had been Poseidon's expectation for Minos to do with the Cretan Bull?,SACRIFICE IT
F001589,Where did the Cretan Bull go after Heracles released it?,MARATHON
F001590,Who caught and sacrificed the bull of Marathon> once captured by Heracles?,THESEUS
F001591,To where did Heracles journey for his 8th labor?,THRACE
F001592,What Thracian king was visited by Heracles for his 8th labor?,DIOMEDES (NOT TROJAN WAR GUY)
F001593,What was special about the Mares of Diomedes?,THEY ATE FLESH
F001594,How did Heracles tame the Mares of Diomedes?,FED DIOMEDES TO THEM
F001595,What did Eurystheus do to the Mares of Diomedes when Heracles brought them?,FREED THEM
F001596,To what goddess did Eurystheus dedicate the Mares of Diomedes?,HERA
F001597,What king of Pherae entertained Heracles on his way to the Mares of Diomedes?,ADMETUS
F001598,Who was the wife of Admetus?,ALCESTIS
F001599,With whom did Heracles wrestle in order to bring back Alcestis?,THANATOS (DEATH)
F001600,What object did Heracles fetch for his 9th labor?,GIRDLE OF HIPPOLYTA
F001601,Of what group was Hippolyta queen?,AMAZONS
F001602,Who killed Hippolyta> queen of the Amazons?,HERACLES
F001603,What princess of Troy was rescued from a sea monster by Heracles?,HESIONE
F001604,What father of Hesione cheated Heracles from his reward for saving her?,LAOMEDON
F001605,Who was Heracles serving when he sacked Troy?,OMPHALE
F001606,To whom did Heracles give Hesione as a bride?,TELAMON
F001607,Who did Heracles put on the throne of Troy after sacking the city?,PODARCES
F001608,By what name is Podarces better known?,PRIAM
F001609,To what land did Heracles travel for his 10th labor?,ERYTHIA
F001610,What did Heracles fetch for his 10th labor?,CATTLE OF GERYON
F001611,What three-bodied monster had his cattle stolen by Heracles?,GERYON
F001612,Who were the parents of Geryon?,CHRYSAOR AND CALLIRHOE
F001613,What giant herdsman assisted Geryon?,EURYTION
F001614,Who was the two-headed hound of Geryon?,ORTHUS
F001615,Who gave Heracles a golden cup to sail on Ocean in order to reach Geryon?,HELIUS
F001616,What did Heracles set up at the Atlantic entrance to the Mediterranean?,PILLARS OF HERACLES
F001617,What is the modern name for the passage where the Pillars of Heracles were posted?,STRAITS OF GIBRALTAR
F001618,By what mythological name were Calpe and Abyla known?,PILLARS OF HERACLES
F001619,By what mythological name were Gibraltar and Ceuta known?,PILLARS OF HERACLES
F001620,Against what tribe did Heracles run out of arrows?,LIGURIANS
F001621,How did Zeus help Heracles when he ran out of arrows against the Ligurians?,RAINED STONES
F001622,What mountain king did Heracles wrestle and kill on Sicily?,ERYX
F001623,What giant and brigand did Heracles kill at the Isthmus of Corinth?,ALCYONEUS
F001624,What did Eurystheus do with the Cattle of Geryon?,SACRIFICED TO HERA
F001625,According to Herodotus> with what snake woman did Heracles visit?,ECHIDNA
F001626,Who were the children of Heracles and Echidna?,AGATHYRSUS> GELONUS AND SCYTHES
F001627,Which of the sons of Heracles and Echidna was able to string Heracles' bow?,SCYTHES
F001628,Of what tribe did Scythes become king and ancestor?,SCYTHIANS
F001629,What objects did Heracles fetch for his 11th labor?,APPLES OF THE HESPERIDES
F001630,Who were the three daughters of Night who guarded golden apples?,HESPERIDES
F001631,What dragon helped the Hesperides guard their golden apples?,LADON
F001632,Who had originally given the golden apples of the Hesperides as a wedding gift?,GAEA
F001633,To whom had Gaea given the golden apples of the Hesperides as a wedding gift?,HERA (MARRIAGE TO ZEUS)
F001634,What sea deity first told Heracles of the location of the garden of the Hesperides?,NEREUS
F001635,Who did Heracles trick to help him get the Apples of the Hesperides?,ATLAS
F001636,Who returned the golden apples to the Hesperides after Eurystheus saw them?,ATHENA
F001637,What Egyptian king who sacrificed strangers to Zeus was killed by Heracles?,BUSIRIS
F001638,What foe of Heracles had a name which meant 'house of Osiris'?,BUSIRIS
F001639,What Libyan giant was wrestled by Heracles?,ANTAEUS
F001640,Who were the parents of the wrestler Antaeus?,GE AN POSEIDON
F001641,How did Antaeus recover his strength?,CONTACT WITH MOTHER EARTH (GE)
F001642,Who used the skulls of his foes to build a temple to his father Poseidon?,ANTAEUS
F001643,Who held Antaeus aloft and crushed him to death?,HERACLES
F001644,What prisoner> chained to a mountain> was released by Heracles?,PROMETHEUS
F001645,In what mountain chain was Prometheus enchained?,CAUCASUS MTS.
F001646,What bird tormented Prometheus when he was enchained in the Caucasus Mts.?,EAGLE
F001647,Who died in place of Prometheus?,CHIRON
F001648,To where did Heracles journey for his 12th labor?,UNDERWORLD
F001649,What did Heracles have to fetch for his 12th labor?,CERBERUS
F001650,What did Heracles say was his most difficult labor?,12TH; TWELTH; CERBERUS
F001651,Who was rescued by Heracles in the underworld?,THESEUS
F001652,What companion of Theseus could not be saved by Heracles in the Underworld?,PIRITHOUS
F001653,What did Theseus do to repay Heracles for rescuing him from the Underworld?,SHELTERED HIM AFTER MEGARA MURDER
F001654,What future brother-in-law did Heracles see in the Underworld?,MELEAGER
F001655,What did Heracles promise to Meleager in the Underworld?,TO MARRY HIS SISTER
F001656,What sister of Meleager did he name as a bride for Heracles?,DEIANIRA
F001657,What Greek playwright wrote a tragedy called Heracles?,EURIPIDES
F001658,What son of Ares robbed men passing from Thessaly to Delphi?,CYCNUS
F001659,Who killed the robber Cycnus> son of Ares?,HERACLES
F001660,What robber forced strangers to work in his vineyard?,SYLEUS
F001661,Where did Syleus live?,BY STRAITS OF EUBOEA
F001662,Who destroyed the vineyards of Syleus and then Syleus himself?,HERACLES
F001663,What tricky pair of dwarfs were told to 'beware of the black-bottomed man'?,CERCOPES
F001664,What god was tricked by the Cercopes?,ZEUS
F001665,Into what did Zeus transform the Cercopes after they tricked him?,APES OR STONES
F001666,What squire of Heracles was lost during the expedition of the Argo?,HYLAS
F001667,Who was lost while drawing water when the nymphs pulled him into the spring?,HYLAS
F001668,At what port was the Argo stopped when Hylas was lost?,CIOS
F001669,What giant was killed by Heracles during the Gigantomachy?,ALCYONEUS
F001670,What king of Pylos refused to purify Heracles after the murder of Iphitus?,NELEUS
F001671,How many of Neleus' 12 sons did Heracles kill after Neleus refused to purify him?,ELEVEN
F001672,What son of Neleus could transform into any bird> beast or insect?,PERICLYMENUS
F001673,Who gave Periclymenus the power of transformation?,POSEIDON
F001674,Who helped Heracles recognize Periclymenus in the form of a bee?,ATHENA
F001675,What did Heracles do to Periclymenus after recognizing him in the form of a bee?,SHOT HIM WITH ARROW
F001676,According to Homer> who wounded Hades among the corpses of Pylos?,HERACLES
F001677,What king of Sparta was punished for assisting Neleus against Heracles?,HIPPOCOON
F001678,What brother of Heracles was killed in his campaign against Hippocoon?,IPHICLES
F001679,With what priestess of Athena did Heracles visit in Tegea?,AUGE
F001680,Who was the son of Heracles and Auge?,TELEPHUS
F001681,Of what people was Telephus king?,MYSIANS
F001682,What king of the Dorians was helped by Heracles against the Lapiths and Dryopes?,AEGIMIUS
F001683,Who was the father of Deianira?,OENEUS
F001684,Where was Oeneus king?,CALYDON
F001685,Who was the brother of Deianira?,MELEAGER
F001686,What river god was wrestled by Heracles to win the hand of Deianira?,ACHELOUS
F001687,What river god was horned like a bull and could change himself into different shapes?,ACHELOUS
F001688,Who wrote Trachiniae?,SOPHOCLES
F001689,What horn did Heracles receive after returning the broken horn of Achelous?,HORN OF AMALTHEA
F001690,By what other name is the horn of Amalthea known?,CORNU COPIAE (CORNUCOPIA)
F001691,What was the name of the goat that suckled Zeus when he was hidden as a baby?,AMALTHEA
F001692,What was the special property of the horn of Amalthea?,ENDLESS FOOD AND DRINK
F001693,What Centaur carried Deianira across a river?,NESSUS
F001694,Across what river did Nessus carry Deianira?,EVENUS
F001695,Who shot Nessus for assaulting Deianira?,HERACLES
F001696,Who gave Deianira his blood> which he said would cure Heracles' wandering eye?,NESSUS
F001697,Who was the son of Deianira and Heracles?,HYLLUS
F001698,Who was the daughter of Deianira and Heracles?,MACARIA
F001699,With what daughter of Eurytus did Heracles fall in love?,IOLE
F001700,What did Eurytus teach young Heracles?,ARCHERY
F001701,What brother of Iole was killed by Heracles in his anger?,IPHITUS
F001702,Who refused to purify Heracles after he murdered Iphitus> the son of Eurytus?,NELEUS
F001703,Who carried off the tripod of Delphi when the priestess refused to help him?,HERACLES
F001704,What was the priestess of Delphi called?,PYTHIA
F001705,Who threw a thunderbolt between Heracles and Apollo to stop their fighting?,ZEUS
F001706,What did Heracles do to be purified for murdering Iphitus?,BE A SLAVE FOR A YEAR
F001707,Who auctioned Heracles as a slave to a queen of the Lydians?,HERMES
F001708,What queen of the Lydians bought the right to Heracles as a slave for a year?,OMPHALE
F001709,With what king of Trachis did Deianira live while Heracles served Omphale?,CEYX
F001710,From what herald of Heracles did Deianira learn of Iole and the sack of Oechalia?,LICHAS
F001711,Who carried the poisoned robe of Deianira to Heracles?,LICHAS
F001712,What herald was hurled to his death into the sea after delivering a poisoned robe?,LICHAS
F001713,On what mountain was the funeral pyre of Heracles?,MT. OETA
F001714,What son of Heracles married Iole?,HYLLUS
F001715,To what shepherd did Heracles give his bow and arrow before dying?,POEAS
F001716,What son of Poeas inherited the bow and arrows of Heracles> using them at Troy?,PHILOCTETES
F001717,Who alone had the right to light the pyre of Heracles?,POEAS
F001718,Who did Heracles marry on Olympus?,HEBE
F001719,What Greek philosopher wrote the Poetics?,ARISTOTLE
F001720,What Greek comic playwright wrote the Frogs?,ARISTOPHANES
F001721,In what city was Heracles born?,THEBES
F001722,What terms refers to the descendants of Heracles?,HERACLIDAE/HERACLIDS
F001723,To what goddess was the head of Eurystheus brought after his fight with Athens?,ATHENA
F001724,What king of Athens received Alcmena after the death of Heracles?,DEMOPHON
F001725,Who was the father of Athenian king Demophon?,THESEUS
F001726,What daughter of Heracles offered herself for sacrifice to assure Athenian victory?,MACARIA
F001727,What nephew of Heracles was rejuvenated by the long-dead Heracles in battle?,IOLAUS
F001728,Who married Rhadamanthys after the death of Amphitryon?,ALCMENA
F001729,Who substituted a stone for the body of Alcmena in her coffin?,HERMES
F001730,Who was advised by Delphi to 'await the third fruit' before returning to the Peloponnese?,HYLLUS
F001731,What king of Tegea killed Hyllus?,ECHEMUS
F001732,What Heraclid learned that the 'third fruit' meant the third generation?,TEMENUS
F001733,What 'three-eyed' man> an Aetolian exile> was used as a guide by the Heraclids?,OXYLUS
F001734,How did Oxylus have three eyes?,RIDING A ONE-EYED HORSE
F001735,What son of Orestes resisted the Heraclids under Temenus?,TISAMENUS
F001736,What sons of Aristodemus took over Lacedaemon (Sparta) after the Heraclid victory?,PROCLES AND EURYSTHENES
F001737,Which of the Heraclids took over Argos?,TEMENUS
F001738,Which of the Heraclids took over Messene?,CRESPHONTES
F001739,What rival Heraclid killed Cresphontes?,POLYPHONTES
F001740,What widow of Cresphontes was forced to marry his killer> Polyphontes?,MEROPE
F001741,What son of Cresphontes and Merope returned to Messene to kill Polyphontes?,AEPYTUS
F001742,What group was often referred to a the Minyae?,ARGONAUTS
F001743,What is the Euxine Sea now called?,BLACK SEA
F001744,What king's name means `Man of the Land`?,AEETES
F001745,Who was the first wife of Athamas?,NEPHELE
F001746,What does the name Nephele mean?,CLOUD
F001747,Who were the children of Athamas and Nephele?,HELLE AND PHRIXUS
F001748,Who was the mother of Helle and Phrixus?,NEPHELE
F001749,Who was the second wife of Athamas?,INO
F001750,Who was the father of Ino?,CADMUS
F001751,Who persuaded the women of Boeotia to parch seed grain so that crops wouldn't grow?,INO
F001752,Who snatched Phrixus and Helle to put them on a golden ram?,NEPHELE
F001753,Who provided the golden ram to Nephele?,HERMES
F001754,What mythological girl gave her name to the Dardanelles?,HELLE
F001755,What other name> for a daughter of Athamas> was given to the straits sometimes called the Dardanelles?,HELLESPONT
F001756,To where did the golden ram carry Phrixus?,COLCHIS
F001757,Who was the king of Colchis?,AEETES
F001758,Who was the father of Aeetes?,HELIUS
F001759,Who were the sisters of Aeetes?,CIRCE AND PASIPHAE
F001760,What daughter of Aeetes married Phrixus?,CHALCIOPE
F001761,Who was the eldest daughter of Aeetes?,CHALCIOPE
F001762,What epithet was applied to Zeus as the god of escape?,PHYXIUS
F001763,In what god's sacred grove was the golden fleece hung?,ARES
F001764,Name the sons of Phrixus and Chalciope.,ARGUS> MELAS> PHRONTIS> CYTISORUS
F001765,Who were the parents of Argus> Melas> Phrontis and Cytisorus?,PHRIXUS AND CHALCIOPE
F001766,Who preceded Pelias as king of Iolcus?,CRETHEUS
F001767,What was the relationship of Athamas and Cretheus?,BROTHERS
F001768,What was the relationship of Cretheus to Pelias?,STEPFATHER
F001769,Who was the wife of Cretheus?,TYRO
F001770,Who were the parents of Pelias?,POSEIDON AND TYRO
F001771,What son of Cretheus and Tyro was the rightful heir to the throne of Iolcus?,AESON
F001772,Whose mother is variously named as Polymede> Alcimede or Amphinome?,JASON
F001773,Who was the father of Jason?,AESON
F001774,Who was the tutor of Jason?,CHIRON
F001775,What mother of Chiron cared for Jason while he was being tutored?,PHILYRA
F001776,Who was warned to beware of the man wearing one sandal?,PELIAS
F001777,Who warned Pelias to beware of the man with one sandal?,DELPHIC ORACLE
F001778,Who appeared to Pelias wearing one sandal?,JASON
F001779,What goddess disguised herself as an old woman and was helped by Jason in crossing a river?,HERA
F001780,What river did Jason help Hera in disguise cross?,ANAURUS
F001781,What goddes favored Jason throughout his adventures?,HERA
F001782,How did Jason lose one sandal?,HELPING HERA ACROSS THE ANAURUS
F001783,Why did Hera not like Pelias?,HE REFUSED TO SACRIFICE TO HER
F001784,Who appeared in a dream to Pelias and ordered him to obtain the Golden Fleece?,PHRIXUS
F001785,What did Jason need to bring in order for Pelias to give up the throne?,GOLDEN FLEECE
F001786,Who was the father of Salmoneus> Alcyone> Athamas> Sisyphus and Cretheus?,AEOLUS
F001787,What daughter of Aeolus married Ceyx> with whom she was later transformed into a kingfisher?,ALCYONE
F001788,Who was the wife of Sisyphus?,MEROPE
F001789,Who were the brothers of Aeson?,AMYTHAON AND PHERES
F001790,Who was the father of Melampus and Bias?,AMYTHAON
F001791,Who was the wife of Bias?,PERO
F001792,Who were the parents of Admetus?,PHERES AND CLYMENE
F001793,Who was the son of Pelias?,ACASTUS
F001794,Who was the brother of Pelias?,NELEUS
F001795,Who was the son of Neleus?,NESTOR
F001796,What daughter of Neleus and sister of Nestor married Bias?,PERO
F001797,What was the relationship of Jason and Admetus?,COUSINS
F001798,What was the relationship of Nestor to Poseidon?,GRANDSON
F001799,What was the relationship of Sisyphus to Aeson?,UNCLE
F001800,What does the name Argo mean?,SWIFT
F001801,Who was the builder of the Argo?,ARGUS
F001802,Who was the father of Argus> builder of the Argo?,ARESTOR
F001803,What deity helped Argus build the Argo?,ATHENA
F001804,To what god was a shrine at Dodona dedicated?,ZEUS
F001805,What special power did the wood in the prow of the Argo have?,SPEECH
F001806,From what land did the oak in the prow of the Argo come?,DODONA
F001807,Who refused to accept leadership of the Argo> in favor of Jason?,HERACLES
F001808,What king of Elis> who also had filthy stables> was among the Argonauts?,AUGEAS
F001809,What leader of the Calydonian boar hunt was among the Argonauts?,MELEAGER
F001810,What father of Achilles was among the Argonauts?,PELEUS
F001811,What father of Ajax the Greater was among the Argonauts?,TELAMON
F001812,What father of Ajax the Lesser was among the Argonauts?,OILEUS
F001813,What father of Palamedes was among the Argonauts?,NAUPLIUS
F001814,Who were the two seers among the Argonauts?,IDMON AND MOPSUS
F001815,Who was the most excellent horsemen among the Argonauts?,CASTOR
F001816,Who was the best boxer among the Argonauts?,POLYDEUCES
F001817,What two brothers and later enemies of the Dioscuri (Castor & Polydeuces) joined them on the Argo?,IDAS AND LYNCEUS
F001818,Which of the Argonauts had such keen sight that he could see beneath the earth?,LYNCEUS
F001819,Which of the Argonauts could take whatever shape he liked in battle?,PERICLYMENUS
F001820,Who was the father of Periclymenus?,NELEUS
F001821,Who gave Periclymenus the gift of transformation?,POSEIDON
F001822,Which of the Argonauts could run across the waves without getting his feet wet?,EUPHEMUS
F001823,Who was the father of Euphemus?,POSEIDON
F001824,Which of the Argonauts had wings?,ZETES AND CALAIS
F001825,Who was the father of Zetes and Calais?,BOREAS (THE NORTH WIND)
F001826,What skilled shipwright was among the Argonauts?,ARGUS
F001827,Who was the first helmsman of the Argo?,TIPHYS
F001828,Who was the father of Achilles?,PELEUS
F001829,Who was the son of Telamon?,AJAX THE GREATER
F001830,Who was the son of Oileus?,AJAX THE LESSER
F001831,Who was the son of Nauplius?,PALAMEDES
F001832,What was the common gift of Idmon and Mopsus?,THEY WERE SEERS (PROPHECY)
F001833,What was the talent of Castor?,HORSEMANSHIP
F001834,What was the talent of Polydeuces?,BOXING
F001835,What was the talent of Lynceus?,KEEN EYESIGHT
F001836,What was the talent of Periclymenus?,TRANSFORMATION
F001837,What was the talent of Euphemus?,FAST RUNNING
F001838,What was the talent of Zetes and Calais?,FLIGHT
F001839,What role did Tiphys play aboard the Argo?,HELMSMAN (HE STEERED THE SHIP)
F001840,Where did the expedition of the Argonauts begin?,IOLCUS
F001841,What island was the first stop of the Argonauts?,LEMNOS
F001842,Who was the queen of Lemnos?,HYPSIPYLE
F001843,Who had punished the women of Lemnos by making them unattractive to their husbands?,APHRODITE
F001844,What did the women of Lemnos do to the men of the island?,KILLED THEM
F001845,What one male resident of Lemnos was not killed with the rest?,THOAS
F001846,Who was the daughter of Thoas?,HYPSIPYLE
F001847,Who was the father of Thoas?,DIONYSUS
F001848,To what deity did Thoas become a priest in the land of the Tauri> just as Iphigenia?,ARTEMIS
F001849,Who were the twin sons of Jason and Hypsipyle?,EUNEOS AND THOAS (OR NEBROPHONUS)
F001850,Who were the parents of Euneus and Nebrophonus?,JASON AND HYPSIPYLE
F001851,Why was Hysipyle driven from the island?,DECEPTION OF HIDING HER FATHER
F001852,What king of Nemea did Hypsipyle later serve> bringing her into contact with the Seven Against Thebes?,LYCURGUS
F001853,What Roman poet wrote the Thebaid?,STATIUS
F001854,What Roman poet wrote the Argonautica?,VALERIUS FLACCUS
F001855,What Roman poet wrote the Heroides?,OVID
F001856,What tribe lived in Cyzicus under the leadership of King Cyzicus?,DOLIONES
F001857,What favor did Heracles do for the Doliones in exchange for their kindness?,KILLED NEARBY EARTHBORN GIANTS
F001858,Whom did the Argonauts accidentally kill when they were mistaken as enemies by the Doliones at night?,KING CYZICUS
F001859,Where did the Argonauts stop after Cyzicus?,CIOS
F001860,Why did the Argonauts stop at Cios?,FOR HERACLES TO REPLACE BROKEN OAR
F001861,Why did Heracles not continue with the Argonauts' expedition after stopping at Cios?,LOST HIS SQUIRE HYLAS
F001862,Who was the squire of Heracles who was lost during the expedition of the Argonauts?,HYLAS
F001863,What body of water was called the Euxine> or Pontus Euxinus?,BLACK SEA
F001864,What Bithynian tribe compelled strangers> like the Argonauts> to box their king?,BEBRYCES
F001865,What king of the Bebryces was a great boxer?,AMYCUS
F001866,Who was the father of Amycus> king of the Bebryces?,POSEIDON
F001867,Which of the Argonauts boxed and killed Amycus?,POLYDEUCES
F001868,What king of Salmydessus was encountered by the Argonauts?,PHINEUS
F001869,What blind prophet was encountered was tormented by the Harpies?,PHINEUS
F001870,What does the name of the Harpies mean?,SNATCHERS
F001871,Who pursued the Harpies so that they wouldn't bother Phineus?,ZETES AND CALAIS
F001872,To where did Zetes and Calais pursue the Harpies?,STROPHADES ISLANDS
F001873,Who put an end to the chase of the Harpies by making them swear not to bother Phineus again?,IRIS
F001874,Who foretold the last portion of the Argonaut's expedition?,PHINEUS
