F000780,Who foretold the end of Odysseus' wanderings and the manner of his death?,TIRESIAS
F000781,Whom did Jupiter and Juno consult to find out whether women or men had more fun?,TIRESIAS
F000782,Who had been turned from man into woman for 7 years after touching serpents with his staff?,TIRESIAS
F000783,Who condemned Tiresias to blindness> according to the myth that he settled a dispute>?,HERA
F000784,Who gave Tiresias the gift of prophecy> according to the myth that he settled a dispute?,ZEUS
F000785,What Roman poet wrote the Metamorphoses?,OVID
F000786,Whose staff has two entwined snakes as a symbol?,ASCLEPIUS
F000787,What fountain was located on the slopes of Mt. Helicon?,HIPPOCRENE
F000788,What goddess did Tiresias stumble upon as she was bathing?,ATHENA
F000789,To what city did Tiresias recommend the Thebans migrate?,HESTIAEA
F000790,From what spring did Tiresias drink> before falling dead on the spot?,TELPHUSA
F000791,Who was the father of Pelops?,TANTALUS
F000792,Who was the wife of Pelops?,HIPPODAMIA
F000793,Who was the father of Hippodamia?,OENOMAUS
F000794,What was the kingdom of Oenomaus?,PISA
F000795,Who served his son to the Gods for dinner?,TANTALUS
F000796,Who was condemned to suffer everlasting hunger and thirst in the underworld?,TANTALUS
F000797,Who ate the shoulder of Pelops?,DEMETER
F000798,Who replaced the shoulder of Pelops?,DEMETER
F000799,With what material was the shoulder of Pelops replaced?,IVORY
F000800,What southern region of the Greek mainland was named after the son of Tantalus?,PELOPONNESE
F000801,What does Peloponnese literally mean?,PELOP'S ISLAND
F000802,Through what type of competition did the suitors of Hippodamia need to beat her father?,CHARIOT RACE
F000803,Where did the chariot race with Oenomaus begin?,PISA
F000804,Where was the finish line of the chariot race with Oenomaus?,ISTHMUS OF CORINTH
F000805,How many suitors had failed to win Hippodamia before the arrival of Pelops?,THIRTEEN
F000806,What had happened to the suitors who failed to beat Oenomaus?,HEADS DECORATED HIS PALACE
F000807,Who supplied the chariot to Pelops for his race with Oenomaus> according to some accounts?,POSEIDON
F000808,Who was the treacherous charioteer of Oenomaus?,MYRTILUS
F000809,What did Myrtilus do after being bribed by Pelops?,REMOVED LINCHPINS FROM OENOMAUS CHARIOT
F000810,Who was the father of Myrtilus?,HERMES
F000811,Who was the sister of Pelops?,NIOBE
F000812,Who killed Myrtilus?,PELOPS
F000813,Who cursed Pelops as he fell to his death> leading to the misfortunes of his descendants?,MYRTILUS
F000814,What body of water is named after the charioteer of Oenomaus?,MYRTOAN SEA
F000815,Who was the father of Tantalus?,ZEUS
F000816,Who were the sons of Pelops> called the Pelopidae?,ATREUS AND THYESTES
F000817,Who was the wife of Atreus?,AEROPE
F000818,Over the throne of what kingdom did Atreus and Thyestes quarrel?,MYCENAE
F000819,What tragic playwright wrote the Electra?,EURIPIDES
F000820,In what kingdom was the new king decided by who had a golden fleece?,MYCENAE
F000821,Who delivered a golden fleece to Atreus?,PAN
F000822,Who seduced his brother's wife to steal his golden fleece?,THYESTES
F000823,Who made the sun travel in the opposite direction in anger over Thyestes deception?,ZEUS
F000824,What Roman author wrote a play called Thyestes?,SENECA
F000825,Who served Thyestes' sons to him in a stew?,ATREUS
F000826,Who was the daughter of Thyestes?,PELOPIA
F000827,Who was the child of Pelopia and Thyestes?,AEGISTHUS
F000828,Who were the sons of Atreus> called the Atredae?,AGAMEMNON AND MENELAUS
F000829,Who succeeded Atreus as king of Mycenae?,AGAMEMNON
F000830,Who was the wife of Agamemnon?,CLYTEMNESTRA
F000831,Who was the mother of Clytemnestra?,LEDA
F000832,Who was the father of Clytemnestra?,TYNDAREUS
F000833,Who was the son of Agamemnon and Clytemnestra?,ORESTES
F000834,Who were the daughters of Agamemnon and Clytemnestra?,IPHIGENIA> ELECTRA AND CHRYSOTHEMIS
F000835,Which of his daughters did Agamemnon try to sacrifice at Aulis?,IPHIGENIA
F000836,To appease what goddess did Agamemnon plan to sacrifice his daughter to gain favorable sailing winds?,ARTEMIS
F000837,What Greek tragedian wrote Iphigenia at Aulis?,EURIPIDES
F000838,With whom did Clytemnestra commit adultery while Agamemnon was away at Troy?,AEGISTHUS
F000839,What was the relationship between Agamemnon and Aegisthus?,COUSINS
F000840,What captive Trojan princess was Agamemnon's concubine?,CASSANDRA
F000841,What pair murdered Agamemnon and Cassandra?,CLYTEMNESTRA AND AEGISTHUS
F000842,What Greek epic poet composed the Odyssey?,HOMER
F000843,Who was the father of Cassandra?,PRIAM
F000844,Where was Agamemnon when he was killed> according to the usual account?,BATH
F000845,At whose court did Orestes grow to manhood?,STROPHIUS
F000846,What was the kingdom of Strophius?,PHOCIS
F000847,Who encouraged Orestes to return to Mycenae?,ELECTRA
F000848,Who murdered Clytemnestra and Aegisthus?,ORESTES
F000849,What one word best describes Orestes murder of Clytemnestra?,MATRICIDE
F000850,What group pursues Orestes after he kills Clytemnestra?,FURIES
F000851,What is another name for the Furies?,ERINYES
F000852,Who wrote the trilogy called the Oresteia?,AESCHYLUS
F000853,What is the third installment of the Oresteia?,EUMENIDES
F000854,What is another> more favorable> name for the Furies or Erinyes?,EUMENIDES
F000855,At what court of Athens was Orestes tried for his crime?,AREOPAGUS (HILL OF ARES)
F000856,Who are the jury of the Areopagus?,ATHENIAN CITIZENS
F000857,What was the middle installment of Aeschylus' Oresteia?,CHEOPHORI (LIBATION BEARERS)
F000858,To what land did Artemis take Iphigenia before she was sacrificed?,TAURIS
F000859,Who wrote the Electra?,EURIPIDES
F000860,Who wrote Iphigenia at Tauris?,EURIPIDES
F000861,What is the modern name for the region where the Tauri lived?,CRIMEA
F000862,Who was the king of the Tauri when Iphigenia served as a priestess there?,THOAS
F000863,What was Orestes told to look for in the land of the Tauri?,WOODEN STATUE OF ARTEMIS
F000864,What goddess appears to help expedite Orestes and Iphigenia's escape from Tauris?,ATHENA
F000865,Who is the wife of Orestes?,HERMIONE
F000866,Who is the mother of Hermione?,HELEN
F000867,Who is the father of Hermione?,MENELAUS
F000868,Besides husband & wife> what other relationship do Orestes and Hermione hold?,COUSINS
F000869,Who is the son of Orestes and Hermione?,TISAMENUS
F000870,Who was the first husband of Hermione?,NEOPTOLEMUS
F000871,What Trojan woman was given to Neoptolemus as the spoils of war?,ANDROMACHE
F000872,Where does Neoptolemus die?,DELPHI
F000873,How did Orestes die?,SNAKE-BITE
F000874,Where was Orestes buried?,TEGEA
F000875,What city-state recovered the bones of Orestes in order to defeat the Tegeans in battle?,SPARTA
F000876,Against what group did Tisamenus die in battle?,HERACLIDAE (DESCENDANTS OF HERACLES)
F000877,Who was the son of Strophius?,PYLADES
F000878,Who the best friend of Pylades?,ORESTES
F000879,Who married Pylades?,ELECTRA
F000880,Who were the two sons of Electra and Pylades?,STROPHIUS AND MEDON
F000881,Who discovers the presence of her brother by two locks of his hair on their father's grave?,ELECTRA
F000882,What nurse of Orestes safely secured his escape after Agamemnon's murder?,CILISSA
F000883,Who dreamed that she gave birth to a snake and nursed it?,CLYTEMNESTRA
F000884,What companion of Orestes returns with him to Mycenae?,PYLADES
F000885,What daughter of Clytemnestra> according to Sophocles> obeys her mother despite Agamemnon's murder?,CHRYSOTHEMIS
F000886,What pair deceptively delivers to Clytemnestra an urn that supposedly contains the ashes of Orestes?,ORESTES AND PYLADES
F000887,Through what pretext had Agamemnon gotten Iphigenia to come to Aulis?,MARRIAGE TO ACHILLES
F000888,Who was the husband of Leda?,TYNDAREUS
F000889,What was the kingdom of Tyndareus?,SPARTA
F000890,In what form did Zeus visit Leda?,SWAN
F000891,Who were the two children of Zeus and Leda?,POLYDEUCES AND HELEN
F000892,Who were the two children of Tyndareus and Leda?,CASTOR AND CLYTEMNESTRA
F000893,What was the Roman name of Polydeuces?,POLLUX
F000894,What was the special skill of Castor?,TAMING HORSES
F000895,What was the special skill of Polydeuces?,BOXING
F000896,Who eventually shared immortality with his mortal brother?,POLYDEUCES
F000897,What term means `sons of Zeus`?,DIOSCURI
F000898,Who were the Dioscuri?,CASTOR AND POLYDEUCES
F000899,With whom did the Dioscuri quarrel over some stolen cattle?,IDAS AND LYNCEUS
F000900,Who was the father of Idas and Lynceus?,APHAREUS
F000901,Which of the Apharidae was killed by Zeus' thunderbolt?,IDAS
F000902,Which of the Apharidae had perfect sight?,LYNCEUS
F000903,What pair spent alternate days on Olympus and in Hades?,CASTOR AND POLYDEUCES
F000904,Who was the father of the intended brides of Idas and Lynceus?,LEUCIPPUS
F000905,What is the collective name for the daughters of Leucippus?,LEUCIPPIDES
F000906,What brothers were associated with St. Elmo's fire?,DIOSCURI
F000907,At what battle did the Dioscuri appear in 496 BC?,LAKE REGILLUS
F000908,Who are the Tyndaridae?,CASTOR AND POLYDEUCES
F000909,Who was the husband of Helen?,MENELAUS
F000910,What was the kingdom of Menelaus?,SPARTA
F000911,Who was the daughter of Helen and Menelaus?,HERMIONE
F000912,What is the more common name of the Trojan prince Alexander?,PARIS
F000913,Who were the parents of Paris?,PRIAM AND HECUBA
F000914,According to Stesichorus> where was Helen during the Trojan War?,EGYPT
F000915,According to Stesichorus> who detained Helen in Egypt?,PROTEUS
F000916,At whose wedding did Eris throw a golden apple?,PELEUS AND THETIS
F000917,What did the apple of Eris say?,FOR THE FAIREST
F000918,What is another name for Eris?,DISCORD
F000919,Who claimed the apple of Eris?,HERA> APHRODITE> ATHENA
F000920,Who foretold that Paris would lead to Troy's destruction?,AESACUS
F000921,What was Hecuba's relationship to Aesacus?,STEPMOTHER
F000922,Where did Priam expose the infant Paris?,MT. IDA
F000923,What kind of animal suckled infant Paris on Mt. Ida?,BEAR
F000924,Who decided that Paris should decide the golden apple judgment?,ZEUS
F000925,Who led three goddesses to Paris?,HERMES
F000926,What did Hera offer Paris as a bribe?,ROYAL POWER
F000927,What did Athena offer Paris as a bribe?,VICTORY IN WAR
F000928,What did Aphrodite offer Paris as a bribe?,HELEN AS HIS WIFE
F000929,Whom did Aphrodite give to Paris as guides to reach Helen?,HIMEROS AND EROS
F000930,Who built the walls of Troy?,APOLLO AND POSEIDON
F000931,Who cheated Apollo and Poseidon from payment for Troy's walls?,LAOMEDON
F000932,What did Apollo send to Troy to punish Laomedon?,PLAGUE
F000933,What did Poseidon send to Troy to punish Laomedon?,SEA MONSTER
F000934,What daughter of Laomedon was exposed to a sea monster?,HESIONE
F000935,Who saved Hesione from the sea monster of Poseidon?,HERACLES
F000936,What payment did Heracles demand of Laomedon for saving Hesione?,LAOMEDON'S IMMORTAL HORSES
F000937,Why had given Laomedon his immortal horses?,GIVEN TO TROS FOR GANYMEDE
F000938,How did Laomedon treat Heracles after he saved Hesione?,DIDN'T PAY HIM
F000939,Whom did Hesione marry after being taken by Heracles?,TELAMON
F000940,Who was the child of Hesione and Laomedon?,TEUCER
F000941,Who killed Laomedon?,HERACLES
F000942,Which of Laomedon's sons did Heracles spare?,PODARCES
F000943,By what better name is the Trojan Podarces known?,PRIAM
F000944,How many sons did Priam have?,50; FIFTY
F000945,How many of Priam's sons were by his first wife?,31; THIRTY-ONE
F000946,Who was the first wife of Priam?,ARISBA
F000947,Who was the second wife of Priam?,HECUBA
F000948,With what nymph did Paris fall in love while on Mt. Ida?,OENONE
F000949,What was the special talent of Oenone?,HEALING
F000950,Who fatally wounded Paris?,PHILOCTETES
F000951,Who refused to heal Paris after Philoctetes wounded him?,OENONE
F000952,Who saved Paris from being killed in combat with Menelaus?,APHRODITE
F000953,Who shot the arrow that killed Achilles?,PARIS
F000954,Who was the father of Laomedon?,ILUS
F000955,Who was the father of Ilus> Assaracus and Ganymede?,TROS
F000956,Who was the father of Tros?,DARDANUS
F000957,Who was the father of Anchises?,CAPYS
F000958,What was the relationship of Capys and Laomedon?,COUSINS
F000959,What was the relationship of Ganymede to Laomedon?,UNCLE
F000960,What was the relationship of Anchises and Priam?,2ND-COUSINS
F000961,Who was the grandfather of Anchises?,ASSARACUS
F000962,Who was the greatest warrior of the Trojans?,HECTOR
F000963,Who was the wife of Hector?,ANDROMACHE
F000964,Who was the father of Andromache?,EETION
F000965,Who killed Eetion?,ACHILLES
F000966,Who was the child of Hector and Andromache?,ASTYANAX
F000967,Which of Priam's sons had the gift of prophecy?,HELENUS
F000968,How did Helenus gain the gift of prophecy?,SNAKES LICKED EARS AS BABY
F000969,Who was the only one of Priam's sons to survive the Trojan War?,HELENUS
F000970,Who became the wife of Helenus?,ANDROMACHE
F000971,Where did Helenus and Andromache rule after escaping Troy?,EPIRUS
F000972,What son of Priam foretells Aeneas' journeys in the Aeneid?,HELENUS
F000973,What son of Priam marries Helen after Paris' death?,DEIPHOBUS
F000974,What son of Priam was known for his love of Cressida?,TROILUS
F000975,Who was the lover of Troilus?,CRESSIDA
F000976,What daughter of Priam received the gift of prophecy from Apollo?,CASSANDRA
F000977,Who> upon rejection> cursed Cassandra that no one would believe her?,APOLLO
F000978,What woman murdered Cassandra?,CLYTEMNESTRA
F000979,In what city did Cassandra die?,MYCENAE
F000980,What daughter of Priam was sacrificed on the tomb of Achilles?,POLYXENA
F000981,On whose tomb was Polyxena sacrificed?,ACHILLES
F000982,Who was the son of Anchises and Aphrodite?,AENEAS
F000983,Who saves Aeneas from being killed in combat with Achilles?,POSEIDON
F000984,What brother of Hecuba strongly opposed the Trojan War?,ANTENOR
F000985,What priestess of Athena was the wife of Antenor?,THEANO
F000986,What city did Antenor and Theano found in Italy after escaping Troy?,PATAVIUM
F000987,What is the modern name of Patavium?,PADUA
F000988,Of what Trojan ally were Glaucus and Sarpedon the leaders?,LYCIANS
F000989,What enemy did Diomedes discover was his hereditary guest-friend?,GLAUCUS
F000990,What did Diomedes and Glaucus exchange?,ARMOR
F000991,What was Diomedes armor made of?,BRONZE
F000992,What was the armor of Glaucus made of?,GOLD
F000993,Who got the better of Diomedes and Glaucus' exchange of armor?,DIOMEDES
F000994,Who killed Glaucus?,AJAX THE GREATER (TELAMONIAN)
F000995,Who was the son of Zeus and Laodamia?,SARPEDON
F000996,Who was the father of Laodamia and grandfather of Sarpedon?,BELLEROPHON
F000997,Who killed Sarpedon?,PATROCLUS
F000998,What honor did Zeus grant on the death of his son Sarpedon?,RAINDROPS OF BLOOD
F000999,Who preserved the body of Sarpedon> upon Zeus' command?,APOLLO
F001000,Who led the Thracian allies of Troy?,RHESUS
F001001,What captured spy told Odysseus and Diomedes of the Thracian camp?,DOLON
F001002,What son of a Muse was killed during a raid of Odysseus and Diomedes?,RHESUS
F001003,What possession of Rhesus became a prize of Odysseus and Diomedes?,WHITE HORSES
F001004,Who was the leader of the Greek forces at Troy?,AGAMEMNON
F001005,What was the kingdom of Agamemnon?,MYCENAE
F001006,What mortal king was called 'Lord of Men' at Troy?,AGAMEMNON
F001007,Who was the father of Agamemnon?,ATREUS
F001008,Who was the brother of Agamemnon?,MENELAUS
F001009,Who was unable to kill Paris because Aphrodite rescued him?,MENELAUS
F001010,Who led the forces of Argos at the Trojan War?,DIOMEDES
F001011,Who was the father of Diomedes?,TYDEUS
F001012,Which goddess most favored Diomedes?,ATHENA
F001013,What two deities were wounded by Diomedes?,ARES AND APHRODITE
F001014,Who travelled with Diomedes to fetch Achilles from Scyros?,ODYSSEUS
F001015,Who travelled with Diomedes to fetch Philoctetes from Lemnos?,ODYSSEUS
F001016,Whose camp did Diomedes and Odysseus raid one night?,RHESUS
F001017,What statue did Odysseus and Diomedes together steal?,PALLADIUM
F001018,Who made the Palladium?,ATHENA
F001019,Who was represented by the Palladium?,PALLAS
F001020,What wise king of Pylos participated in the Trojan War?,NESTOR
F001021,Who was the father of Nestor?,NELEUS
F001022,What son of Nestor fought at Troy?,ANTILOCHUS
F001023,Who killed Nestor's son Antilochus?,MEMNON
F001024,Which of the Greeks at Troy was second only to Achilles as a warrior?,AJAX THE GREATER
F001025,Who was the father of the Ajax the Greater?,TELAMON
F001026,From what island did Ajax the Greater originate?,SALAMIS
F001027,Who provided cover while Menelaus and Meriones recovered Patroclus?,AJAX THE GREATER
F001028,Who calls Telamonian Ajax the 'bulwark of the Achaeans'?,HELEN
F001029,To whom does Helen describe the Greeks as they fight in the plain?,PRIAM
F001030,Who loses to Odysseus in the contest for Achilles' armor?,AJAX THE GREATER
F001031,Who was the father of Ajax the Lesser?,OILEUS
F001032,What group does Ajax the Lesser lead at Troy?,LOCRIANS
F001033,Who sacrilegiously assaulted Cassandra during the sack of Troy?,AJAX THE LESSSER
F001034,Who led the Cretan forces during the Trojan War?,IDOMENEUS
F001035,Who was the father of Idomeneus?,DEUCALION
F001036,What king of Crete came voluntarily rather as Agamemnon's bound ally?,IDOMENEUS
F001037,What king pretended to be mad when summoned to fight at Troy?,ODYSSEUS
F001038,What was the kingdom of Odysseus?,ITHACA
F001039,Who yoked an ox to an ass and sowed his fields with salt?,ODYSSEUS
F001040,Who put Odysseus' infant son in front of Odysseus' plow?,PALAMEDES
F001041,Who was the infant son of Odysseus used by Palamedes to reveal him?,TELEMACHUS
F001042,Who was the mother of Telemachus?,PENELOPE
F001043,Who was the second-cleverest of the Greeks at Troy?,PALAMEDES
F001044,Who was the father of Palamedes?,NAUPLIUS
F001045,Who vengefully contrived the death of Palamedes?,ODYSSEUS
F001046,Who was the craftiest and wisest of the Greeks at Troy?,ODYSSEUS
F001047,What unattractive figure was attacked by Odysseus during a council?,THERSITES
F001048,Who was the greatest of the Greek warriors at Troy?,ACHILLES
F001049,Who were the followers of Achilles at Troy?,MYRMIDONS
F001050,Who were the parents of Achilles?,PELEUS AND THETIS
F001051,Who was the father of Thetis?,NEREUS
F001052,Who rejected Thetis upon learning her son would be greater than his father?,ZEUS
F001053,What two figures first knew that Thetis' son would excede his father?,PROMETHEUS AND THEMIS
F001054,Who turned herself into many shapes to evade her suitor Peleus?,THETIS
F001055,Into what river did Thetis dip Achilles to make him immortal?,STYX
F001056,What one part of Achilles remained vulnerable?,HEEL
F001057,Who taught Achilles music and other skills?,CHIRON
F001058,Who was fated to live long and die ingloriously> or die young and gloriously?,ACHILLES
F001059,On what island was Achilles disguised as a girl?,SCYROS
F001060,Who was the king of Scyros where Achilles hid> disguised as a girl?,LYCOMEDES
F001061,What daughter of Lycomedes fell in love with Achilles?,DEIDAMIA
F001062,Who was the son of Achilles and Deidamia?,NEOPTOLEMUS
F001063,By what other name was Neoptolemus known?,PYRRHUS
F001064,What is the meaning of the name Pyrrhus?,REDHEAD
F001065,What pair exposed Achilles' disguise on Scyros?,ODYSSEUS AND DIOMEDES
F001066,What led Achilles to take off his disguise as a girl and put on armor?,TRUMPET BLAST
F001067,Who blew the trumpet that caused Achilles to strip his disguise?,AGYRTES
F001068,Who had arranged for a trumpet to sound at the court of Lycomedes?,ODYSSEUS
F001069,What Roman author wrote the Achilleid?,STATIUS
F001070,Who> besides Chiron> served as a tutor of Achilles?,PHOENIX
F001071,What curse had been laid upon Phoenix by his father?,CHILDLESSNESS
F001072,What companion of Achilles had killed a friend over a dice game as a child?,PATROCLUS
F001073,From what port did the Greek army sail for Troy?,AULIS
F001074,Who was the prophet of the Greek army at Troy?,CALCHAS
F001075,What goddess caused the unfavorable winds for the Greeks at Troy?,ARTEMIS
F001076,Why did Artemis cause unfavorable winds for the Greeks at Aulis?,AGAMEMNON KILLED SACRED STAG
F001077,Who was sacrificed at Aulis to bring favorable winds?,IPHIGENIA
F001078,Who were the parents of Iphigenia?,AGAMEMNON AND CLYTEMNESTRA
F001079,Where did Iphigenia have to be fetched from to go to Aulis?,MYCENAE
F001080,On what pretext was Iphigenia brought to Aulis?,MARRIAGE TO ACHILLES
F001081,What goddess saved Iphigenia> according to some sources?,ARTEMIS
F001082,To what land did Artemis take the rescued Iphigenia?,LAND OF THE TAURI
F001083,What is the modern name for the area occupied by the Tauri?,CRIMEA (ON THE BLACK SEA)
F001084,What Roman author wrote De Rerum Natura (On the Nature of Things)?,LUCRETIUS
F001085,Who foretold the 10-year war with Troy after a vision of a snake eating chicks?,CALCHAS
F001086,Who was fated to die if he met a cleverer prophet than himself?,CALCHAS
F001087,Whom did Calchas challenge to a seer contest after the Trojan War?,MOPSUS
F001088,How did Mopsus win his contest with Calchas?,GUESSED # OF UNRIPE FIGS ON TREE
F001089,What happened to Calchas when Mopsus beat him in a contest?,DIED ON THE SPOT
F001090,Who first guided the Greek fleet to the island of Chryse?,PHILOCTETES
F001091,Who was the father of Philoctetes?,POEAS
F001092,What happened to Philoctetes on the island of Chryse?,BITTEN ON FOOT BY SERPENT
F001093,On what island did the Greeks abandon Philoctetes due to his noxious wound?,LEMNOS
F001094,Who lit the funeral pyre of Heracles?,POEAS
F001095,What did Poeas receive as a result of lighting Heracles' funeral pyre?,HERACLES' BOW AND ARROWS
F001096,Who told the Greeks that Heracles' bow and arrows were needed to take Troy?,HELENUS
F001097,Who was the father of Helenus?,PRIAM
F001098,What pair fetched Philoctetes from Lemnos?,ODYSSEUS AND DIOMEDES
F001099,What pair healed Philoctetes?,PODALIRIUS AND MACHAON
F001100,Who was the father of Podalirius and Machaon?,ASCLEPIUS
F001101,Who used the bow and arrows of Heracles to kill Paris?,PHILOCTETES
F001102,Whom did Achilles wound during an invasion of Mysia?,TELEPHUS
F001103,Who was the father of Telephus> wounded by Achilles?,HERACLES
F001104,Who was healed by scrapings from Achilles spear?,TELEPHUS
F001105,Who was the first Greek to leap ashore at Troy?,PROTESILAUS
F001106,Who killed Protesilaus?,HECTOR
F001107,Who was the wife of Protesilaus?,LAODAMIA
F001108,Who brought Protesilaus back to Laodamia from the underworld for a few hours?,HERMES
F001109,What Trojan killed in the first skirmish was transformed into a swan?,CYCNUS
F001110,Who was the father of Cycnus?,POSEIDON
F001111,What priestess of Apollo was originally awarded to Agamemnon?,CHRYSEIS
F001112,What priest of Apollo was the father of Chryseis?,CHRYSES
F001113,Whom did Agamemnon take from Achilles to compensate for losing Chryseis?,BRISEIS
F001114,What poem is often described as 'the wrath of Achilles'?,ILIAD
F001115,What did Apollo do to the Greeks in answer to the prayer of Chryses?,SENT PLAGUE
F001116,Who pleads with Zeus to help the Trojans while her son Achilles sat out?,THETIS
F001117,In what book of the Iliad do Menelaus and Paris duel?,3; THREE
F001118,In what book of the Iliad does Hector bid farewell to Andromache?,6; SIX
F001119,What city was also referred to as Ilium?,TROY
F001120,To which of the Greeks was Andromache enslaved after the Trojan War?,NEOPTOLEMUS
F001121,What happened to Astyanax when Troy was sacked?,THROWN FROM WALLS
F001122,What three envoys come to Achilles in Iliad book 9 to ask for his return?,ODYSSEUS> PHOENIX> AJAX (GR.)
F001123,Who does Achilles allow to use his armor to fight the Trojans?,PATROCLUS
F001124,What son of Zeus is killed by Patroclus?,SARPEDON
F001125,Who wounded Patroclus with a spear after he was dazed by Apollo?,EUPHORBUS
F001126,Who killed Patroclus?,HECTOR
F001127,After whose death does Achilles end his feud with Agamemnon?,PATROCLUS
F001128,Who fasioned new armor for Achilles after the death of Patroclus?,HEPHAESTUS
F001129,What god was called the cloud-gatherer?,ZEUS
F001130,With what river god does Achilles fight at Troy?,SCAMANDER
F001131,Why was the Scamander River angry with Achilles?,FILLED WITH TROJAN CORPSES
F001132,How many times does Achilles chase Hector around the walls of Troy?,3; THREE
F001133,Which Trojan hero was called the 'tamer of horses'?,HECTOR
F001134,Who assumes the form of Deiphobus to deceive Hector in combat?,ATHENA
F001135,Who kills Hector?,ACHILLES
F001136,Whose body does Achilles drag behind his chariot?,HECTOR
F001137,Who comes to the Trojan camp to ransom the body of Hector?,PRIAM
F001138,What deity helps Priam reach Achilles in the Trojan camp?,HERMES
F001139,With whose funeral does the Iliad conclude?,HECTOR
F001140,What nymph was called 'silver footed'?,THETIS
F001141,Whose horse prophesies his death in Iliad book 19?,ACHILLES
F001142,What is the name of Achilles' talking horse> which prophesies his death?,XANTHUS
F001143,What does the term 'theomachy' refer to?,BATTLE BETWEEN GODS
F001144,Whom does Homer call the mother of Aphrodite?,DIONE
F001145,What god was called 'earth-shaker'?,POSEIDON
F001146,Who led the Amazons at Troy?,PENTHESILEA
F001147,Who killed Penthesilea?,ACHILLES
F001148,Who taunts Achilles while he mourns the death of Penthesilea?,THERSITES
F001149,Who kills Thersites?,ACHILLES
F001150,To what island is Achilles required to withdraw for the murder of Thersites?,LESBOS
F001151,Who purifies Achilles at Lesbos for the murder of Thersites?,ODYSSEUS
F001152,Who led the Ethiopian contingent to Troy?,MEMNON
F001153,Who was the mother of Memnon> king of the Ethiopians?,EOS
F001154,What was the Roman name of Eos?,AURORA
F001155,Of what was Eos the goddess?,DAWN
